{"architecture":{"auditor_format":8,"authority_directory_labels":22,"chronology_sha256":"88320941dc608ab02e2512aaa1ad6ee19b827935615fb9c4cb707973449c4c61","chronology_stages":9,"combined_authority_events":212,"local_controls":36,"packet_events_per_phase":106,"production_writable_labels":4,"r10_controls":62,"self_test_writable_labels":1,"total_controls":98},"archive_id":"real-r-constructor-v8-cb5a33ca-db79299d","authority":{"hosted_base":"cb351ad25803be35edd776245a37e24c69a03f3f","public_branch":"archive/real-r-constructor-v8-public-disposition","review_disposition":"source_auditor_migration_go_only","separately_executed_reviews":2},"current_authority":false,"execution":{"auditor_static_gate_accepted":true,"auditor_token_structural_mutants_rejected":64,"full_runtime_replayed_for_public_disposition":false,"source_compile_optimization_levels":[0,2],"source_compile_python_versions":["3.11.13","3.14.6"]},"format":"pid-rs/real-r-constructor-public-disposition/v1","licensing":{"payload_publication_rights_confirmed":false,"public_disposition_license":"MIT OR Apache-2.0"},"nonclaims":["archive_does_not_authenticate_pre_archive_provenance_or_custody","archive_is_not_active_pid_rs_code_or_a_release_input","auditor_source_is_not_a_successful_execution_record","auditor_source_is_not_third_party_or_failure_independent_validation","not_a_project_domain_classification","not_cross_platform_or_environment_reproduction","not_filesystem_metadata_exact","not_formal_verification","not_license_provenance_proof","not_method_catalog_authority","not_pid_or_wibral_method_evidence","not_r_receipt_construction_or_publication_evidence","not_scientific_novelty","not_security_or_privacy_attestation","not_source_logic_correctness_proof","not_source_or_author_authentication"],"privacy":{"explicit_owner_public_disclosure_approval_recorded":false,"payload_withheld":true,"raw_paths_repeated_in_public_metadata":false,"secret_scanner_findings":0,"withheld_reason":"personal_and_local_path_metadata"},"source_identities":[{"bytes":348609,"encoding":"ASCII","git_blob_sha1":"f994472bc8e5dd959007a6af2546a519c4066b5a","included_in_public_branch":false,"line_endings":"LF","personal_home_path_occurrences":6,"private_tmp_path_occurrences":11,"role":"constructor","sha256":"cb5a33ca69ef8a377292170b78308e094c1c2b07ed8d32eb0f8991faa9e97803","source_observed_mode":"0600","terminal_newline":true},{"bytes":375722,"encoding":"ASCII","git_blob_sha1":"ba53ee281d125c3053cd7d124b26caf43a3234a2","included_in_public_branch":false,"line_endings":"LF","personal_home_path_occurrences":0,"private_tmp_path_occurrences":0,"role":"independent_auditor_design","sha256":"db79299daf10c0b470d109ae95c436775b06aecdd3aa3a9fdc8c4997e9b8d083","source_observed_mode":"0600","terminal_newline":true}],"status":"public_disposition_only_source_withheld_private","support_files":[{"bytes":3721,"path":"audit/archive/real-r-constructor-v8-cb5a33ca-db79299d/ARCHITECTURE.md","role":"architecture_record","sha256":"5afd5e9e2aade4f458d015002c2e8d5e5e0d69580d3e01b2fbac25149e1b2614"},{"bytes":4598,"path":"audit/archive/real-r-constructor-v8-cb5a33ca-db79299d/DISPOSITION.md","role":"human_disposition","sha256":"1437398882a38e26f0bdb57e1100f6dafcca00851029884d7d2e2010c45bc013"},{"bytes":9640,"path":"audit/archive/real-r-constructor-v8-cb5a33ca-db79299d/INDEX.schema.json","role":"index_schema","sha256":"255d8efa98cc884516701051a22287b49a75b9b7760150c3569f8aa4e3355f85"}]}
